{
  "schema_version": "1.0",
  "updated": "2026-08-07",
  "note": "12 种电商广告视频类型（v1.1：category_match 已扩展覆盖全部 14 品类，新增 material_match 质感维度供非服装品类使用）。score_weights 供 03 逻辑 §7 六维打分使用；镜头序列直接作为分镜表骨架。条目中含『（仅…）』标注的为特殊限定匹配（如 ⑧国风×3C 仅限国风数码产品），常规商品不命中。",
  "types": [
    {
      "id": "tvc",
      "name": "TVC电影感大片",
      "icon": "①",
      "positioning": "品牌旗舰款、上新首发、高客单价；品牌调性天花板",
      "lens_language": "大场景开场（航拍/建筑/自然）→ 升格慢动作 → 人物情绪特写 → 品牌收尾",
      "light": "黄金时刻/蓝调时刻为主，光影叙事",
      "style_dna": [
        "电影感",
        "升格慢动作",
        "大场面",
        "情绪氛围",
        "环境音"
      ],
      "duration": "30-60s",
      "ai_difficulty": 3,
      "avoid": "别贪大场面导致商品变小；商品占比<30%的镜头删掉",
      "shot_sequence": [
        "航拍钩子2s",
        "升格转身4s",
        "面料微距3s",
        "情绪特写4s",
        "逆光剪影3s",
        "产品定格2s"
      ],
      "category_match": [
        "连衣裙",
        "礼服",
        "冬装",
        "高端面料",
        "美妆",
        "香水",
        "食品",
        "酒类",
        "3C数码",
        "数码",
        "家居",
        "家具",
        "鞋靴",
        "运动鞋",
        "箱包",
        "皮具",
        "配饰",
        "围巾",
        "个护",
        "洗护",
        "母婴",
        "奶粉",
        "运动户外",
        "户外装备",
        "宠物",
        "宠物主粮",
        "汽车用品",
        "车膜",
        "珠宝钟表",
        "珠宝",
        "手表"
      ],
      "fabric_match": [
        "高光泽",
        "哑光高级",
        "蓬松保暖"
      ],
      "material_match": [
        "光泽",
        "哑光",
        "蓬松"
      ],
      "price_match": [
        "高客单",
        "轻奢"
      ],
      "occasion_match": [
        "约会",
        "社交"
      ],
      "season_match": [
        "秋冬"
      ],
      "tone_match": [
        "高级",
        "优雅"
      ]
    },
    {
      "id": "magazine",
      "name": "时尚杂志Lookbook",
      "icon": "②",
      "positioning": "设计感款式、轻奢、上新Lookbook；静态美学+微动",
      "lens_language": "棚拍/建筑场景硬照感、pose定格、微风吹动、硬光造型",
      "light": "棚拍硬光/单侧光，高对比",
      "style_dna": [
        "杂志大片",
        "硬照",
        "设计感构图",
        "克制动态"
      ],
      "duration": "15-30s",
      "ai_difficulty": 4,
      "avoid": "动态别写大，动作写微动/定格/轻摆，否则破坏硬照感",
      "shot_sequence": [
        "静物钩子2s",
        "pose定格全景4s",
        "特写3s",
        "换装场景4s",
        "硬照收尾2s"
      ],
      "category_match": [
        "连衣裙",
        "高端面料",
        "设计款",
        "美妆",
        "彩妆",
        "食品",
        "甜品",
        "3C数码",
        "数码",
        "家居",
        "软装",
        "鞋靴",
        "皮鞋",
        "箱包",
        "手袋",
        "配饰",
        "丝巾",
        "个护",
        "洗护",
        "母婴",
        "礼盒",
        "运动户外",
        "健身器材",
        "宠物",
        "宠物用品",
        "汽车用品",
        "车载",
        "珠宝钟表",
        "珠宝"
      ],
      "fabric_match": [
        "高光泽",
        "哑光高级"
      ],
      "material_match": [
        "光泽",
        "哑光",
        "硬挺"
      ],
      "price_match": [
        "高客单",
        "轻奢"
      ],
      "occasion_match": [
        "社交"
      ],
      "season_match": [],
      "tone_match": [
        "高级",
        "极简"
      ]
    },
    {
      "id": "street",
      "name": "街头纪实街拍",
      "icon": "③",
      "positioning": "日常款、通勤款、大众款；真实种草",
      "lens_language": "跟拍走路、自然光、真实街景、动态抓拍感",
      "light": "自然光为主，不刻意打光",
      "style_dna": [
        "街头跟拍",
        "自然光",
        "真实生活",
        "走路动态"
      ],
      "duration": "15-30s",
      "ai_difficulty": 5,
      "avoid": "别写棚拍/硬光，破坏真实感；背景别太干净",
      "shot_sequence": [
        "街景钩子2s",
        "正面跟拍4s",
        "侧面过肩3s",
        "回眸特写3s",
        "背影远去3s"
      ],
      "category_match": [
        "通勤西装",
        "衬衫",
        "牛仔",
        "休闲",
        "运动",
        "童装",
        "冬装",
        "美妆",
        "口红",
        "食品",
        "小吃",
        "3C数码",
        "手机",
        "家居",
        "生活用品",
        "鞋靴",
        "运动鞋",
        "帆布鞋",
        "箱包",
        "双肩包",
        "配饰",
        "帽子",
        "个护",
        "洗护",
        "母婴",
        "推车",
        "运动户外",
        "骑行",
        "宠物",
        "牵引",
        "汽车用品",
        "车载",
        "珠宝钟表",
        "首饰"
      ],
      "fabric_match": [
        "硬挺结构",
        "轻薄飘逸",
        "蓬松保暖",
        "科技机能"
      ],
      "material_match": [
        "硬挺",
        "轻透",
        "蓬松",
        "机能"
      ],
      "price_match": [
        "中客单",
        "低价"
      ],
      "occasion_match": [
        "通勤",
        "度假",
        "户外"
      ],
      "season_match": [
        "春夏"
      ],
      "tone_match": [
        "街头",
        "真实",
        "生活"
      ]
    },
    {
      "id": "story",
      "name": "场景剧情微电影",
      "icon": "④",
      "positioning": "场景型商品、情感营销（约会/通勤/度假故事）",
      "lens_language": "有情节、人物互动、场景叙事、起承转合",
      "light": "随剧情走，氛围优先",
      "style_dna": [
        "叙事",
        "人物互动",
        "场景转场",
        "情绪递进"
      ],
      "duration": "30-60s",
      "ai_difficulty": 2,
      "avoid": "对话/复杂互动谨慎；多镜用统一场景换机位保一致性；单镜头内只做单一动作",
      "shot_sequence": [
        "情境钩子3s",
        "相遇4s",
        "互动4s",
        "特写3s",
        "情绪3s",
        "收尾2s"
      ],
      "category_match": [
        "连衣裙",
        "情感营销品",
        "美妆",
        "香水",
        "食品",
        "3C数码",
        "手机",
        "家居",
        "鞋靴",
        "皮鞋",
        "箱包",
        "手袋",
        "配饰",
        "围巾",
        "个护",
        "洗护",
        "母婴",
        "奶粉",
        "运动户外",
        "露营",
        "宠物",
        "宠物粮",
        "汽车用品",
        "安全座椅",
        "珠宝钟表",
        "戒指"
      ],
      "fabric_match": [],
      "material_match": [],
      "price_match": [],
      "occasion_match": [
        "约会",
        "社交"
      ],
      "season_match": [],
      "tone_match": [
        "情感",
        "浪漫"
      ]
    },
    {
      "id": "function",
      "name": "产品功能演示",
      "icon": "⑤",
      "positioning": "功能性卖点（显瘦/防晒/防水/版型），卖点可视化",
      "lens_language": "特写为主、局部对比、面料/版型/工艺演示",
      "light": "棚拍+硬侧光，突出细节",
      "style_dna": [
        "功能演示",
        "特写",
        "细节",
        "对比"
      ],
      "duration": "10-30s",
      "ai_difficulty": 3,
      "avoid": "对比效果用分镜切换，不要一个镜头内做对比",
      "shot_sequence": [
        "卖点钩子2s",
        "面料特写3s",
        "工艺特写3s",
        "上身效果4s",
        "卖点定格2s"
      ],
      "category_match": [
        "通勤西装",
        "衬衫",
        "运动",
        "户外",
        "冬装",
        "美妆",
        "粉底",
        "食品",
        "冲泡",
        "3C数码",
        "数码",
        "家居",
        "收纳",
        "鞋靴",
        "运动鞋",
        "箱包",
        "旅行箱",
        "配饰",
        "个护",
        "洗护",
        "母婴",
        "纸尿裤",
        "运动户外",
        "帐篷",
        "宠物",
        "猫砂",
        "汽车用品",
        "脚垫",
        "珠宝钟表",
        "手表"
      ],
      "fabric_match": [
        "硬挺结构",
        "科技机能",
        "蓬松保暖"
      ],
      "material_match": [
        "硬挺",
        "机能",
        "蓬松"
      ],
      "price_match": [],
      "occasion_match": [],
      "season_match": [],
      "tone_match": []
    },
    {
      "id": "unboxing",
      "name": "开箱细节评测",
      "icon": "⑥",
      "positioning": "新客信任建设、高价值品；手部+触感展示",
      "lens_language": "第一人称、手部动作、触感展示、拆包仪式感",
      "light": "柔光，近景",
      "style_dna": [
        "开箱",
        "手部动作",
        "触感",
        "真实"
      ],
      "duration": "15-30s",
      "ai_difficulty": 3,
      "avoid": "手部动作写简单（抚摸/展开/拉链），复杂手势易畸形；负面词必带手部防畸",
      "shot_sequence": [
        "包装钩子2s",
        "开箱3s",
        "触摸面料3s",
        "上身4s",
        "细节2s"
      ],
      "category_match": [
        "内衣",
        "家居服",
        "高价值品",
        "美妆",
        "口红",
        "食品",
        "零食",
        "3C数码",
        "数码",
        "家居",
        "家具",
        "鞋靴",
        "运动鞋",
        "箱包",
        "手提包",
        "配饰",
        "帽子",
        "个护",
        "洗护",
        "母婴",
        "母婴礼盒",
        "运动户外",
        "户外装备",
        "宠物",
        "宠物粮",
        "汽车用品",
        "车载",
        "珠宝钟表",
        "珠宝"
      ],
      "fabric_match": [],
      "material_match": [
        "光泽",
        "哑光",
        "蓬松"
      ],
      "price_match": [
        "高客单"
      ],
      "occasion_match": [
        "居家"
      ],
      "season_match": [],
      "tone_match": [
        "真实",
        "信任"
      ]
    },
    {
      "id": "mood",
      "name": "情绪氛围种草",
      "icon": "⑦",
      "positioning": "小红书种草、氛围型品类；生活方式贩卖",
      "lens_language": "慢镜头、氛围音乐感、情绪镜头、空镜、光影流动",
      "light": "逆光/柔光/烛光，氛围优先",
      "style_dna": [
        "氛围",
        "慢动作",
        "情绪",
        "光影",
        "生活方式"
      ],
      "duration": "15-30s",
      "ai_difficulty": 5,
      "avoid": "商品别在氛围里淹没：每3镜至少1镜商品清晰",
      "shot_sequence": [
        "空镜钩子2s",
        "氛围转身4s",
        "光影特写3s",
        "生活场景4s",
        "情绪定格2s"
      ],
      "category_match": [
        "连衣裙",
        "高端面料",
        "内衣",
        "家居服",
        "童装",
        "度假款",
        "美妆",
        "香水",
        "香氛",
        "食品",
        "咖啡",
        "3C数码",
        "数码",
        "家居",
        "香薰",
        "灯具",
        "鞋靴",
        "运动鞋",
        "箱包",
        "皮具",
        "配饰",
        "围巾",
        "丝巾",
        "个护",
        "沐浴露",
        "母婴",
        "安抚",
        "运动户外",
        "露营",
        "宠物",
        "宠物窝",
        "汽车用品",
        "车载香薰",
        "珠宝钟表",
        "珠宝",
        "珍珠"
      ],
      "fabric_match": [
        "高光泽",
        "哑光高级",
        "轻薄飘逸"
      ],
      "material_match": [
        "光泽",
        "哑光",
        "轻透"
      ],
      "price_match": [
        "中客单"
      ],
      "occasion_match": [
        "约会",
        "度假",
        "居家"
      ],
      "season_match": [
        "春夏"
      ],
      "tone_match": [
        "浪漫",
        "生活",
        "优雅"
      ]
    },
    {
      "id": "guofeng",
      "name": "国风东方美学",
      "icon": "⑧",
      "positioning": "国风品牌、丝绸/旗袍/汉服、文化感",
      "lens_language": "中式场景、意境构图、留白、衣袂飘动",
      "light": "自然光/灯笼光/窗光，水墨意境",
      "style_dna": [
        "国风",
        "中式意境",
        "衣袂飘飘",
        "留白构图"
      ],
      "duration": "15-30s",
      "ai_difficulty": 3,
      "avoid": "意境词要有具体场景支撑（庭院/回廊/竹林），别只写仙气",